{"$schema":"https://json-schema.org/draft/2020-12/schema","$id":"agentpass.source-bundle.v1","type":"object","additionalProperties":false,"required":["version","kind","organization_id","app_id","project_id","agent_session_id","device_id","file_merkle_root","manifest_digest","total_bytes","created_at","expires_at"],"properties":{"version":{"const":1},"kind":{"const":"agentpass.source-bundle"},"organization_id":{"format":"uuid"},"app_id":{"format":"uuid"},"project_id":{"format":"uuid"},"agent_session_id":{"format":"uuid"},"device_id":{"format":"uuid"},"git_commit":{"pattern":"^[0-9a-f]{64}$"},"dirty_tree_digest":{"pattern":"^[0-9a-f]{64}$"},"file_merkle_root":{"pattern":"^[0-9a-f]{64}$"},"manifest_digest":{"pattern":"^[0-9a-f]{64}$"},"total_bytes":{"type":"integer","minimum":0,"maximum":1073741824},"created_at":{"type":"string","pattern":"^\\d{4}-\\d{2}-\\d{2}T\\d{2}:\\d{2}:\\d{2}\\.\\d{3}Z$"},"expires_at":{"type":"string"},"lockfile_digests":{"type":"array","maxItems":64},"redacted_findings":{"type":"array","maxItems":64}}}
