{"version":1,"kind":"agentpass.source-bundle","organization_id":"11111111-1111-4111-8111-111111111111","app_id":"22222222-2222-4222-8222-222222222222","project_id":"33333333-3333-4333-8333-333333333333","agent_session_id":"44444444-4444-4444-8444-444444444444","device_id":"55555555-5555-4555-8555-555555555555","file_merkle_root":"aaaaaaaaaaaaaaaaaaaaaaaaaaaaaaaaaaaaaaaaaaaaaaaaaaaaaaaaaaaaaaaa","manifest_digest":"bbbbbbbbbbbbbbbbbbbbbbbbbbbbbbbbbbbbbbbbbbbbbbbbbbbbbbbbbbbbbbbb","total_bytes":1024,"created_at":"2026-01-01T00:00:00.000Z","expires_at":"2026-01-02T00:00:00.000Z","lockfile_digests":[],"redacted_findings":[]}
